title,company,expected,link,project,level,work mode,salary,salary_for,city,ukrainian_people
ML Ops Engineer,DCG,"ML Ops,Azure SQL","https://www.pracuj.pl/praca/ml-ops-engineer-warszawa,oferta,1003713949","As a recruitment company, DCG understands that every business is powered by experienced professionals. Our management style and partnership approach enable us to meet your needs and provide continuous support. Due to our ongoing growth and the large number of recruitment projects we undertake for our partners, we are currently looking for:ML Ops Engineer",specialist (Mid / Regular),home office work,,,,False
Administrator Linux,CENTRUM KART S A,"Linux,Oracle,Jira","https://www.pracuj.pl/praca/administrator-linux-warszawa,oferta,1003687432",,specjalista (Mid / Regular),praca hybrydowa,,,,False
Administrator systemów / DevOps,Stowarzyszenie Autorów ZAiKS,"Docker,Bash,Python,Kubernetes,GIT,REST API,Rest API","https://www.pracuj.pl/praca/administrator-systemow-devops-warszawa-nalewki-8,oferta,1003682459",,"specjalista (Mid / Regular), młodszy specjalista (Junior)",praca hybrydowa,12000–16000,brutto / mies.,Warszawa,False
Application / Product Security Engineer,ABB Business Services,"Python,Bash,PowerShell,Jenkins,GitLab CI,CircleCI,Travis CI,AWS,Azure,Google Cloud,Docker,Kubernetes","https://www.pracuj.pl/praca/application-product-security-engineer-lodz,oferta,1003703352","We are an international pioneering technology leader that is writing the future of industrial digitalization. At the forefront is our Corporate Technology Center which provides industry leading software and deep domain expertise to help the world’s most asset-intensive industries solve their biggest challenges.,To strengthen our team in IIoT Platform and Applications stream, we are looking for a Application/Product Security Engineer, who is an effective team player with excellent communication skills. As an IIoT P&A stream we are developing unified approach for software which consists of set of services and apps with individual lifecycles hosted on top of ABB common platforms for on-prem execution and cloud. Seize this unique opportunity and see your work transformed into a hive of tangible products.,As an Application/Product Security Engineer you will be working with cross-functional and agile teams which operates in an international environment.",specialist (Mid / Regular),hybrid work,,,,True
Data Engineer with AI,SNI sp. z o.o.,"azure databricks,Azure Data Factory,Python,SQL,Azure OpenAI Service,Azure Data Lake,Generative AI,MLOps","https://www.pracuj.pl/praca/data-engineer-with-ai-wroclaw,oferta,1003686766","We are looking for Senior Data Engineer with experience in AI projects to join our team and help us integrate AI solutions into our applications. In this role, you will be responsible for supporting internal users and processes by solving maintenance and data quality issues, and ensuring the efficient operation of our organization's systems.","senior specialist (Senior), expert",hybrid work,"170,00–200,00",net (+ VAT) / hr.,,False
Test Automation Engineer,ITDS Polska Sp. z o.o.,"Python,Cucumber.js","https://www.pracuj.pl/praca/test-automation-engineer-warszawa,oferta,1003688565","As a QA Engineer, you will be working for our Client – one of the largest Investments Banks in the world. You will join the Security Payment Team and become responsible for testing the newest features implemented to the incoming payment messaging platform. The goal of the Team is to create a single button testing environment that will fast pace the launch of the whole platform.,Create a testing environment for a cutting-edge payment platform!,Opportunity to work in Warsaw with the possibility of working 3 days a week from the city centre","specialist (Mid / Regular), senior specialist (Senior)",home office work,18900–29400,net (+ VAT) / mth.,,True
Senior Data Engineer,SNI sp. z o.o.,"Azure Databricks,Azure Data Factory,Power BI,Python,MSSQL,DevOps - pipelines,CI/CD,SQL,Spark/PySpark,ADLS blob storage","https://www.pracuj.pl/praca/senior-data-engineer-wroclaw,oferta,1003682674",Sales & Finance Analytics team is looking for Data Engineer. We process financial and sales data to provide data products to our customers around the World. Our mission is to expose value of data and support client to become fully operational data driven company.,"starszy specjalista (Senior), ekspert",praca hybrydowa,,,,False
"ASPICE process, requirements and administration engineer",BWI Poland Technologies,SQL,"https://www.pracuj.pl/praca/aspice-process-requirements-and-administration-engineer-balice-pow-krakowski-kapitana-mieczyslawa-medweckiego-2,oferta,1003715689",,specialist (Mid / Regular),hybrid work,,,Balice (pow. krakowski),True
Quality Assurance Automation Specialist,AT&T,"SQL,AZURE,JavaScript,Python,Bash,PowerShell,GIT","https://www.pracuj.pl/praca/quality-assurance-automation-specialist-katowice,oferta,1003648757","We are seeking a dedicated Quality Assurance Automation Engineer to join our team and play a vital role in ensuring the highest quality of our back-end and front-end web applications.,The QA Engineer will be responsible for designing and implementing tests, debugging, and defining corrective actions, as well as reviewing system requirements and tracking quality assurance metrics.,A key aspect of this role involves conducting tests before product launches to ensure software runs smoothly, meets client needs, and remains cost-effective. Our ideal candidate will possess a background in both software development and quality assurance, demonstrating a commitment to excellence and continuous improvement.",specjalista (Mid / Regular),praca stacjonarna,,,,False
"Data Platform Engineer (Python, Java, AWS)",JellyTech,"Python,Java,AWS,Kubernetes,Docker,ETL,CI/CD,Hadoop","https://www.pracuj.pl/praca/data-platform-engineer-python-java-aws-warszawa-encyklopedyczna-2a,oferta,1003720266",Projekt związany z pracą nad architekturą dużych baz danych.,"specjalista (Mid / Regular), starszy specjalista (Senior)",praca zdalna,23000–27000,netto (+ VAT) / mies.,Warszawa,False
DevOps Engineer,Reply Polska Sp. z o.o.,"Python,Java,Scala,Docker,Kubernetes,OpenShift,Terraform,Jenkins,GitLab,PostgreSQL,Redis,Kafka","https://www.pracuj.pl/praca/devops-engineer-katowice-wroclawska-54,oferta,1003708288",,"specialist (Mid / Regular), senior specialist (Senior)",hybrid work,16000–22000,gross / mth.,Katowice,False
Senior Python Developer for GenAI,SQUARE ONE RESOURCES sp. z o.o.,"FastAPI,Python,Azure Functions,Azure Storage,OAuth,Docker","https://www.pracuj.pl/praca/senior-python-developer-for-genai-warszawa-pulawska-2,oferta,1003709875","AI and Deals data strategy are made possible via the Connect Deals Experience ecosystem, specifically Engagement Hub, Data Studio and Junction.,Work is already underway across Deals to identify viable ideas to deliver even more automation and efficiency for our teams and clients through the application of GenAI.,Remote vs Onsite: 99% remote; mandatory attendance to planning sessions/workshops four times a year (able to travel freely around UK and Europe),HackerRank Challenge: Yes,US Hours overlap needed: Yes, 11:00 - 19:00 CET (11am - 7pm)",senior specialist (Senior),home office work,"160,00–180,00",net (+ VAT) / hr.,Warszawa,False
Data Analytics Manager - Operation Department,T-Mobile,"MS SQL,Oracle,PostgreSQL,MongoDB,Gitlab,AWS,Azure,Python","https://www.pracuj.pl/praca/data-analytics-manager-operation-department-warszawa-marynarska-12,oferta,1003696979","In the Operations Department, we focus on proactive failure prevention and quick resolution of problems reported by customers. We manage the maintenance of networks, infrastructure and IT applications.,We supervise the network on a 50-meter screen, monitor and support applications 24/7, analyze customer satisfaction with the services we provide and improve our operational processes to make our network even more reliable, redundant and optimized. Thanks to the work of over 180 people from our department - everything WORKS!","kierownik / koordynator, menedżer","praca stacjonarna, praca hybrydowa",,,Warszawa,True
Senior Security Engineer/ Senior Pentester,Grupa Pracuj,"security code review,DAST,SAST,SCA","https://www.pracuj.pl/praca/senior-security-engineer-senior-pentester-warszawa-prosta-68,oferta,1003698163",,starszy specjalista (Senior),praca zdalna,15000–19000,brutto / mies.,Warszawa,False
Senior Cloud Engineer,EPAM Systems (Poland) sp. z o.o.,"Terraform,ARM,CloudFormation,Maven,Gradle,GitLab,Kubernetes,Helm,Istio,Microsoft Azure","https://www.pracuj.pl/praca/senior-cloud-engineer-krakow,oferta,1003682368","We are looking for a Senior Cloud Engineer to join our multi-versed team and contribute to the client’s success.,You’ll be working on key cloud strategic initiative to containerize and migrate heritage applications to AKS both in Azure and client’s data-centres.,You’ll be working in the Investment Bank engineering team based in London and Krakow. EPAM’s role is to provide oversight, support, and solutions to implement a strategic architecture for public cloud services. We help by sharing the architecture vision, working with teams on their solution design, creating code samples and documentation, and ensuring that the developer experience of migrating to the cloud within our organization is easy and enticing.,This role offers a hybrid model, with 2 days per week working from the client's office in Krakow.,If you're ready to make an impact in a dynamic environment, we want to hear from you!",senior specialist (Senior),hybrid work,,,,False
Administrator Systemów,NASK SPÓŁKA AKCYJNA,"Debian,Red Hat,Docker,DNS","https://www.pracuj.pl/praca/administrator-systemow-warszawa-11-listopada-23,oferta,1003669511",,"specjalista (Mid / Regular), starszy specjalista (Senior)","praca stacjonarna, praca hybrydowa",,,Warszawa,False
Senior Data Engineer,GPC GLOBAL TECHNOLOGY CENTER,"SQL,Python","https://www.pracuj.pl/praca/senior-data-engineer-krakow-lubicz-23a,oferta,1003716806","Working with a modern analytics stack, including Google Cloud, BigQuery, Informatica, and Python, the Senior Data Engineer will be building data pipelines, transforming, structuring, and operationalizing data to support BI, Analytics, and Data Science projects.",senior specialist (Senior),hybrid work,,,Kraków,False
Inżynier/ka zapewnienia jakości (testy manualne),NASK,,"https://www.pracuj.pl/praca/inzynier-ka-zapewnienia-jakosci-testy-manualne-warszawa-kolska-12,oferta,1003707159",,specjalista (Mid / Regular),praca hybrydowa,8000–12000,brutto / mies.,Warszawa,False
Software Engineer,Sonova Warsaw Service Center Sp. z o.o.,"C#,Python","https://www.pracuj.pl/praca/software-engineer-warszawa,oferta,1003687622","Sonova AG is looking for a dedicated and experienced Software Engineer in Test Automation to join our Research and Development team. The successful candidate will be responsible for designing and developing software components, platforms, services, and applications for automated testing of Sonova Group’s software solutions.",specialist (Mid / Regular),hybrid work,,,,True
Starszy Administrator (Inżynier Sieci LAN/WAN),Giełda Papierów Wartościowych w Warszawie S.A,"Microsoft Azure,Cisco,Red Hat,Ansible,Terraform,Python,Shell","https://www.pracuj.pl/praca/starszy-administrator-inzynier-sieci-lan-wan-warszawa-ksiazeca-4,oferta,1003682489",,starszy specjalista (Senior),praca hybrydowa,,,Warszawa,False
Application / Product Security Engineer,ABB Business Services,"Python,Bash,PowerShell,Jenkins,GitLab CI,CircleCI,Travis CI,AWS,Azure,Google Cloud,Docker,Kubernetes","https://www.pracuj.pl/praca/application-product-security-engineer-krakow-przy-rondzie-4,oferta,1003703349","We are an international pioneering technology leader that is writing the future of industrial digitalization. At the forefront is our Corporate Technology Center which provides industry leading software and deep domain expertise to help the world’s most asset-intensive industries solve their biggest challenges.,To strengthen our team in IIoT Platform and Applications stream, we are looking for a Application/Product Security Engineer, who is an effective team player with excellent communication skills. As an IIoT P&A stream we are developing unified approach for software which consists of set of services and apps with individual lifecycles hosted on top of ABB common platforms for on-prem execution and cloud. Seize this unique opportunity and see your work transformed into a hive of tangible products.,As an Application/Product Security Engineer you will be working with cross-functional and agile teams which operates in an international environment.",specialist (Mid / Regular),hybrid work,,,Kraków,True
Senior Fullstack Software Engineer (m/f/d) - AI,Wolters Kluwer Polska Sp. z o.o.,"AWS,Azure,Python,TypeScript","https://www.pracuj.pl/praca/senior-fullstack-software-engineer-m-f-d-ai-warszawa-przyokopowa-33,oferta,1003722630",,"senior specialist (Senior), expert",home office work,,,Warszawa,False
Senior Prompt Engineer – Gen AI,Accenture Technology,"META,OpenAI,Python,Google Colab","https://www.pracuj.pl/praca/senior-prompt-engineer-gen-ai-katowice,oferta,1003714915",,senior specialist (Senior),hybrid work,,,,False
Data Visualization Engineer,Reply Polska Sp. z o.o.,"SQL,Python,R","https://www.pracuj.pl/praca/data-visualization-engineer-katowice,oferta,1003695532",,specialist (Mid / Regular),hybrid work,20000–30000,net (+ VAT) / mth.,,False
Specjalista ds. Walidacji Modeli,GRUPA PZU,,"https://www.pracuj.pl/praca/specjalista-ds-walidacji-modeli-warszawa,oferta,1003709217",,specjalista (Mid / Regular),praca hybrydowa,,,,False
Senior DevOps Engineer - DevOps Lead,SKY ENGINE sp. z o.o.,"Docker,Git,GitLab,AWS,Google Cloud Platform,Bash,Python","https://www.pracuj.pl/praca/senior-devops-engineer-devops-lead-warszawa-pulawska-182,oferta,1003710563","The Senior Lead DevOps Engineer will be responsible for managing and advancing our DevOps practices, focusing on introducing best DevOps practices, solutions based in public clouds, automating infrastructure, and ensuring robust and scalable automation solutions. This role requires deep technical expertise, leadership capabilities, and the ability to drive strategic initiatives across teams.","senior specialist (Senior), expert",hybrid work,27000–35000,net (+ VAT) / mth.,Warszawa,False
Data Engineer (Python/SQL/ETL) Part-Time,SQUARE ONE RESOURCES sp. z o.o.,"Python,ETL,SQL,Transform","https://www.pracuj.pl/praca/data-engineer-python-sql-etl-part-time-warszawa-pulawska-2,oferta,1003665484","We are seeking a skilled Data Engineer to join our team for a strategic data management project. This product is designed to provide critical data and applications that facilitate strategic decision-making, aligning project portfolios with business strategies. You will play a vital role in executing projects and assessing strategic execution while enabling diversification of risk across the project portfolio. Your efforts will support the coordination of various development projects within and across Local Capability Teams (LCTs), ensuring optimal utilization of financial, human, and technical resources to maximize overall project delivery performance.,Work Mode: 100% Remote,Working Hours: Part-time, 20 hours per week",specialist (Mid / Regular),home office work,"120,00–135,00",net (+ VAT) / hr.,Warszawa,False
Data Scientist,ITFS sp. z o.o.,,"https://www.pracuj.pl/praca/data-scientist-warszawa,oferta,1003666275","Miejsce pracy: 100% zdalnie,Start projektu: ASAP (maks. 30 dni OW),Forma współpracy: B2B z ITFS, zaangażowanie długoterminowe,Stawka: 140-160 zł/h netto +VAT,Branża: nowe technologie/AI,Proces rekrutacyjny: Rozmowa z rekruterem ITFS-> rozmowa miękko-techniczna z Klientem-> Decyzja",specjalista (Mid / Regular),praca zdalna,"140,00–160,00",netto (+ VAT) / godz.,,False
Python Developer (aspiring Solution Architect/Lead),SQUARE ONE RESOURCES sp. z o.o.,"Python,Flask,Celery,Redis,PostgreSQL,PySpark,Docker,Azure DevOps","https://www.pracuj.pl/praca/python-developer-aspiring-solution-architect-lead-warszawa,oferta,1003719579","The project aims to automate the creation of assessment dossiers for health technologies within clinical trials. These dossiers are used to evaluate the clinical, economic, and social impact of new treatments, drugs, or medical devices to support decision-making in healthcare systems.,The main goal is to improve both quality and efficiency by leveraging advanced technologies and Artificial Intelligence. This initiative is part of a larger program designed to rethink how clinical trials are conducted in the pharmaceutical industry, enhancing workflows, accelerating time to market, and generating clinical data more efficiently.","senior specialist (Senior), expert",home office work,26000–30000,net (+ VAT) / mth.,,False
Machine Learning Engineer,Edge One Solutions Sp. z o.o.,"TensorFlow,PyTorch,Scikit-learn,Python,R,Java,C++,SQL,NoSQL,Pandas,NumPy,AWS","https://www.pracuj.pl/praca/machine-learning-engineer-warszawa,oferta,1003712887","O kliencie,Nasz klient to jedna z największych grup medialnych w Polsce, będąca częścią globalnego koncernu. Grupa oferuje szeroką gamę treści w różnych formatach – od kanałów telewizyjnych, przez platformy cyfrowe, po produkcję oryginalnych treści. Działa na polskim rynku od ponad 25 lat, ciesząc się dużą popularnością wśród widzów, dzięki wysokiej jakości programom informacyjnym, rozrywkowym, dokumentalnym oraz sportowym.,Projekt,Poszukujemy utalentowanego i zmotywowanego inżyniera Machine Learning (ML), który dołączy do naszego dynamicznego zespołu. Jako Machine Learning Engineer będziesz odpowiedzialny za projektowanie, rozwój i wdrażanie modeli ML w różnych dziedzinach, takich jak analiza danych, predykcja, rozpoznawanie wzorców i automatyzacja procesów. Jeśli pasjonujesz się sztuczną inteligencją, masz doświadczenie w pracy z danymi i algorytmami oraz chcesz wnieść swój wkład w tworzenie innowacyjnych rozwiązań, to ta rola jest dla Ciebie!",specjalista (Mid / Regular),praca zdalna,,,,False
Security Engineer/ Pentester,Grupa Pracuj,"security code review,DAST,SAST,SCA","https://www.pracuj.pl/praca/security-engineer-pentester-warszawa-prosta-68,oferta,1003698089",,specjalista (Mid / Regular),praca zdalna,13000–16000,brutto / mies.,Warszawa,False
Application Middleware Engineer with French,Cyclad,,"https://www.pracuj.pl/praca/application-middleware-engineer-with-french-krakow,oferta,1003700521","Location: Katowice or Kraków or Lublin or Opole or Wrocław (one from those locations to choose; hybrid model of work - once a week from the office),Type of employment: employment contract,Project language: French and English",specialist (Mid / Regular),hybrid work,,,,True
Programista C++ / Linux,CREOTECH INSTRUMENTS S.A.,"C,C++,Linux,Git","https://www.pracuj.pl/praca/programista-c%2b%2b-linux-warszawa-osmanska-14,oferta,1003669693",,specjalista (Mid / Regular),praca hybrydowa,,,Warszawa,False
Full Stack Developer,Mindbox S.A.,"Python,.NET,Microsoft SQL Server","https://www.pracuj.pl/praca/full-stack-developer-krakow,oferta,1003704151",,specialist (Mid / Regular),hybrid work,"165,00–190,00",net (+ VAT) / hr.,,True
Starszy Inżynier IT,PKO Bank Polski SA,"AWS,Microsoft Azure,Google Cloud Platform,Bash,Python,Jenkins,GitLab,Docker,Kubernetes,Terraform,Ansible","https://www.pracuj.pl/praca/starszy-inzynier-it-warszawa-chmielna-89,oferta,1003706670","Dołącz do nas jako:  STARSZY INŻYNIER IT - Formacja Transformacji Chmurowej,Stack technologiczny:,Obszar: Zarządzanie infrastrukturą jako kodem (IaC) oraz praktyki DevOps,Zarządzanie: Automatyzacja tworzenia i zarządzania środowiskami przy użyciu Terraform i Ansible, projektowanie i obsługa pipeline'ów CI/CD,Narzędzia: Docker, Kubernetes, Jenkins, GitLab CI, Prometheus, Grafana, ELK Stack (Elasticsearch, Logstash, Kibana),Umiejętności: Konteneryzacja, procesy CI/CD, monitorowanie i zarządzanie logami, zarządzanie zasobami w chmurze (AWS, Azure, Google Cloud), integracja bezpieczeństwa w pipeline'ach CI/CD, automatyzacja procesów, skrypty (Bash, Python),Doświadczenie: Doświadczenie w zarządzaniu IaC, orkiestracji kontenerów, środowiskach chmurowych, zasadach bezpieczeństwa w DevOps, automatyzacji procesów oraz rozwiązywaniu problemów sieciowych.,Pracuj w miejscu, które zna każdy.,#TyWybierasz",starszy specjalista (Senior),praca hybrydowa,,,Warszawa,False
DSP Engineer,MEDISENSONIC S.A.,"Python,C++,MATLAB","https://www.pracuj.pl/praca/dsp-engineer-warszawa-ulica-franciszka-szuberta-11,oferta,1003717737",,specialist (Mid / Regular),"full office work, hybrid work",,,Warszawa,False
QA Engineer (f/m),Axpo Polska sp. z o.o.,"Python,Java,JavaScript","https://www.pracuj.pl/praca/qa-engineer-f-m-warszawa-rondo-daszynskiego-2b,oferta,1003679951",,specialist (Mid / Regular),"home office work, hybrid work",,,Warszawa,False
Data Engineer,REMITLY POLAND SPÓŁKA Z OGRANICZONĄ ODPOWIEDZIALNOŚCIĄ,"AWS,Python","https://www.pracuj.pl/praca/data-engineer-krakow-pawia-17,oferta,1003701310","The Data Infrastructure Engineering team's mission is to enable product teams to deliver their goals by equipping them with a robust platform and expected data quality and cadency.,As a Data Engineer, you'll work on technical challenges including designing and developing a data platform and its integrations. That means working with other teams to establish data interfaces and contracts.,The team is located in Cracow and works with the US-based Data Infrastructure team. You will report directly to the Cracow-based Engineering Manager.","specialist (Mid / Regular), senior specialist (Senior)",hybrid work,20500–31500,gross / mth.,Kraków,True
Software Engineering Graduate Program 2025,Dell Technologies,"Python,C,C++,Java,SQL","https://www.pracuj.pl/praca/software-engineering-graduate-program-2025-warszawa-inflancka-4a,oferta,1003714781","Our Software R&D Center in Poland gathered great software specialists who want to make a lasting impact on our solutions — and on the future of technology across the industry.,Join us to participate in innovative software projects (developing world’s best storage solutions, Kubernetes based platforms, AI, cybersecurity), learn from the best engineers and build your dream career in one of the best IT companies in the world. Become a Software Engineer (Graduate), a member of the Software Engineering Graduate Program at our Software R&D Center in Poland.,We are looking for talented individuals interested in: Backend Development, DevOps, QA Engineering.,To give new hires the ability to learn across different solutions and quickly enhance an IT knowledge, we are offering an unique program that consists of three 12-month rotations (real work on different projects).,Our Software Engineering Graduate Program allows for candidates new to software engineering or systems engineering to join a fast-paced, dynamic organization in a supportive environment that encourages fast learning and growth.","specialist (Mid / Regular), junior specialist (Junior)",hybrid work,,,Warszawa,True
Senior AI Engineer,SQUARE ONE RESOURCES sp. z o.o.,"Python,RAG,Microsoft Azure","https://www.pracuj.pl/praca/senior-ai-engineer-warszawa-pulawska-2,oferta,1003707299","Reimagining the audit profession. By leveraging Microsoft’s emerging AI technology, we’re building the first AI agent-powered audit platform that will fundamentally change how our audits work, while enhancing the overall experience for our clients.",senior specialist (Senior),home office work,,,Warszawa,False
Senior Automation Engineer,Mindbox S.A.,"Python,PowerShell,Ansible,Jenkins,Docker,Kubernetes","https://www.pracuj.pl/praca/senior-automation-engineer-krakow,oferta,1003708180",,senior specialist (Senior),hybrid work,26000–33000,net (+ VAT) / mth.,,True
Senior Data Analyst (Operations),Allegro,"SQL,Looker,Tableau,Power BI","https://www.pracuj.pl/praca/senior-data-analyst-operations-poznan-wierzbiecice-1b,oferta,1003706354",,starszy specjalista (Senior),praca hybrydowa,,,Poznań,False
Blue Yonder Junior Technical Consultant,Rhenus Warehousing Solutions Polska Sp. z o.o.,"Blue Yonder,WMS,Python,Perl,SQL,Microsoft SQL Server,Java,PowerShell","https://www.pracuj.pl/praca/blue-yonder-junior-technical-consultant-warszawa-komitetu-obrony-robotnikow-48,oferta,1003716661","As Rhenus Warehousing Solutions, we belong to the Rhenus Group, which is one of the leading providers of global logistics services.,Rhenus Warehousing Solutions is implementing Blue Yonder (BY) WMS in the warehouses across the globe. In order to provide the best value for our operational sites and customers, Rhenus is building a strong internal WMS organization. This organization will consist of a central BY WMS Competence Center (CC) and Regional Implementation Centers, which will work together with Blue Yonder CC and other internal and external partners.,For the CC and the Implementation Centers, Rhenus is looking for WMS professionals  who combine a deep understanding of warehousing business and processes, and a profound knowledge of BY WMS.,If you have the ambition to be a part of this journey, see the world as your playground and want to develop your professional competencies, join us!,We are currently looking for talents to join our global IT structures in Warehousing Solution Business Unit, who will work from our office in Warsaw, Poland.",specialist (Mid / Regular),hybrid work,,,Warszawa,False
