title,company,expected,link,project,level,work mode,salary,salary_for,city,ukrainian_people
Data Engineer (Fulfillment),Tesco Technology,"Scala,Python,Apache Yarn,Apache Hive,Kyuubi,Airflow","https://www.pracuj.pl/praca/data-engineer-fulfillment-krakow-przy-rondzie-4,oferta,1003698208","The Fulfillment Data department at Tesco Technology is at the forefront of data processing and order fulfillment within the retail and technology industry. This vital department handles a range of responsibilities, including:,Analyzing order and delivery data to optimize logistics processes and enhance delivery efficiency.,Managing critical data related to customer orders, suppliers, and products to ensure the seamless flow of our fulfillment operations.,Upholding data integrity and security during the processing of order and delivery-related information.,As we continue to expand, we are actively seeking a skilled Data Engineer to join our team of analytics experts. In this role, you will take charge of expanding and refining our data and data pipeline architecture. Additionally, you will be instrumental in optimizing data flow and collection to cater to the needs of cross-functional teams.,Our ideal candidate is an experienced data pipeline builder and data enthusiast who relishes the opportunity to optimize data systems and construct them from the ground up. As a Data Engineer, you will collaborate closely with software developers, database architects, data analysts, and data scientists on various data-driven initiatives. You will play a crucial role in ensuring that the optimal data delivery architecture remains consistent across all ongoing projects.,This role calls for a high level of self-direction and the ability to effectively support the data requirements of multiple teams, systems, and products. If you are enthusiastic about the prospect of optimizing, and possibly even redesigning, our company's data architecture to support our next generation of products and data initiatives, we encourage you to apply and be part of our dynamic team shaping the future of our data operations!",specialist (Mid / Regular),hybrid work,18500–26000,gross / mth.,Kraków,True
Staż #Konica Minolta Adventure​ w dziale Video Solution Services,Konica Minolta Business Solutions Polska,,"https://www.pracuj.pl/praca/staz-%23konica-minolta-adventure-w-dziale-video-solution-services-warszawa,oferta,1003664876",,praktykant / stażysta,praca mobilna,,,,False
"Assistant Vice President, Model Validation (Credit Risk)",HSBC Service Delivery (Polska) Sp. z o.o.,"Python,R,SAS","https://www.pracuj.pl/praca/assistant-vice-president-model-validation-credit-risk-krakow-kapelanka-42a,oferta,1003679138","The role of the AVP/Senior AVP is to perform model review (i.e., quantitative analysis and qualitative research with focus on model data, design, performance, and implementation) to formulate opinions about models’ conceptual soundness and adequacy for intended usage. Role responsibilities also cover documentation of conclusions and identified model risk indicators.",manager / supervisor,hybrid work,,,Kraków,True
Linux Administrator,HCL Poland,"Kubernetes,JBoss,Tomcat,Go,Angular,Python,.NET","https://www.pracuj.pl/praca/linux-administrator-krakow-opolska-112,oferta,1003698199",,specialist (Mid / Regular),home office work,,,Kraków,False
Full Stack Power BI Developer,Integer Group Services Sp. z o.o,,"https://www.pracuj.pl/praca/full-stack-power-bi-developer-warszawa-czerniakowska-87a,oferta,1003716262",,specjalista (Mid / Regular),praca hybrydowa,,,Warszawa,False
MLOps,Devire,,"https://www.pracuj.pl/praca/mlops-warszawa,oferta,1003680474","Devire IT Outsourcing is a form of cooperation dedicated to IT professionals, based on the principles of own business - B2B, implementing projects for clients running innovative and modern projects.,Our client is one of the world's largest food and beverage companies. They are looking for MLOps who join their Data Science Hub Europe and will be part of a team dedicated to delivering efficient and high-quality data solutions. You will collaborate with data scientists, data analysts, and engineers to build, scale, and operate our machine learning &amp; analytics platform.,Your skill, competence, and creativity will directly support and impact critical business decisions,in areas of supply chain and marketing.,Salary: 100-130 zł/h netto (B2B) (additional days-off),Location: remote position with occasional visits in the office every 1-2 months,Language: communication in English daily",specialist (Mid / Regular),home office work,"100,00–130,00",net (+ VAT) / hr.,,False
Risk Modelling Analyst,Citi Handlowy,,"https://www.pracuj.pl/praca/risk-modelling-analyst-warszawa-senatorska-16,oferta,1003666273",,specialist (Mid / Regular),hybrid work,,,Warszawa,False
QA Automation Tech Lead (Computer Networking),PLVISION,"Python,Pytest,PTF","https://www.pracuj.pl/praca/qa-automation-tech-lead-computer-networking-krakow-siewna-18,oferta,1003712078","The project's key focus is to extend SONiC's capabilities to meet the unique requirements of a disaggregated network stack focused on providing low-latency, high-speed communication for high-performance computing (HPC) environments, ensuring smooth integration with the switch's hardware, and maintaining high-performance traffic.,In this role, you will start a new project based on Software for Open Networking in the Cloud (SONiC) — the most popular open-source network operating system. You will lead the QA project team and contribute to developing an embedded networking device.,You will join a collaborative and rewarding environment with open, transparent communication, well-established processes, minimum formalities, and maximum trust. This is your chance to secure your career and gain valuable skills by working in a strong expert community.","senior specialist (Senior), expert",home office work,,,Kraków,True
UiPath Developer,Scalo Sp. z o.o.,Python,"https://www.pracuj.pl/praca/uipath-developer-krakow,oferta,1003689213",,specjalista (Mid / Regular),praca hybrydowa,"140,00–170,00",netto (+ VAT) / godz.,,False
Business Unit Technical Manager,Reply Polska Sp. z o.o.,"Java,Python,SAP,Spring Framework","https://www.pracuj.pl/praca/business-unit-technical-manager-katowice-wroclawska-54,oferta,1003695531",,team manager,hybrid work,22000–28000,gross / mth.,Katowice,False
Senior Cloud Engineer - Oracle Cloud,GPC GLOBAL TECHNOLOGY CENTER,"Google Cloud Platform,Azure,AWS","https://www.pracuj.pl/praca/senior-cloud-engineer-oracle-cloud-krakow-lubicz-23a,oferta,1003678584","As a Senior Engineer specializing in Oracle Cloud, you will be responsible for designing, implementing, and managing robust and scalable cloud solutions. You will work closely with cross-functional teams to ensure our cloud infrastructure aligns with business goals and operates efficiently and securely.",senior specialist (Senior),hybrid work,,,Kraków,False
Lead Performance Engineer (6 months),VML Enterprise Solutions Sp. z o.o.,"JMeter,K6,Locust,LoadRunner,Python,Data Dog,Dynatrace,AppDynamics,New Relic,AWS,Google Cloud Platform,DB2,Oracle","https://www.pracuj.pl/praca/lead-performance-engineer-6-months-poznan-wierzbiecice-1a,oferta,1003687619","The Lead Performance Engineer plays a critical role in ensuring the performance, scalability, and reliability of our innovative platform project that provides holistic AI solutions to our internal and external audiences. This role demands a highly motivated and experienced individual with a deep understanding of performance testing methodologies, tools, and analysis. The Lead Performance Engineer will be responsible for driving the performance testing strategy, mentoring junior team members, and collaborating with cross-functional teams to identify and resolve performance bottlenecks. This individual will also be instrumental in researching and implementing new performance testing tools and techniques to continuously improve our performance engineering practices.",expert,home office work,25000–34000,net (+ VAT) / mth.,Poznań,True
Mainframe Storage Engineer,Edge One Solutions Sp. z o.o.,"REXX,Python","https://www.pracuj.pl/praca/mainframe-storage-engineer-krakow,oferta,1003676624","Nasz klient to międzynarodowa instytucja finansowa z siedzibą w Brukseli specjalizująca w obsłudze transakcji na rynkach kapitałowych. Zapewnia rozliczenia, przechowywanie i obsługę krajowych i transgranicznych papierów wartościowych, od obligacji, akcji i instrumentów pochodnych po fundusze inwestycyjne. Łączy ponad 2000 rynków finansowych i uczestników na całym świecie.",specjalista (Mid / Regular),praca hybrydowa,,,,False
Młodszy Analityk,DSV ISS,,"https://www.pracuj.pl/praca/mlodszy-analityk-warszawa-tasmowa-10,oferta,1003719745",,"specjalista (Mid / Regular), młodszy specjalista (Junior)",praca hybrydowa,,,Warszawa,False
Senior Data Scientist Analyst,Brown Brothers Harriman,"Python,SQL","https://www.pracuj.pl/praca/senior-data-scientist-analyst-krakow-stanislawa-klimeckiego-1,oferta,1003714665","As a Data Scientist you will play a critical part in BBH Digital transformation by conducting research, designing, prototyping, and validating machine learning models to assure achievement of desired business outcomes.",senior specialist (Senior),hybrid work,,,Kraków,True
Senior Manager Wholesale Impairments and Stress Testing,HSBC Service Delivery (Polska) Sp. z o.o.,,"https://www.pracuj.pl/praca/senior-manager-wholesale-impairments-and-stress-testing-krakow-kapelanka-42a,oferta,1003696718",,director,hybrid work,,,Kraków,True
Administrator DevOps,MATRONIX Marcin Moczulski,"Kubernetes,Red Hat,Debian,Linux,Ansible,Helm,Git,Bash,Grafana,Prometheus,PostgreSQL,Docker","https://www.pracuj.pl/praca/administrator-devops-pawlowice-pow-pszczynski,oferta,1003721367",,"specjalista (Mid / Regular), starszy specjalista (Senior)",praca stacjonarna,8000–13000,brutto / mies.,,False
Senior Software Engineer (Machine Learning - MLOps) for Product Intelligence Team,Tesco Technology,"Python,Fine,Microsoft Azure","https://www.pracuj.pl/praca/senior-software-engineer-machine-learning-mlops-for-product-intelligence-team-krakow-przy-rondzie-4,oferta,1003698205","Product Intelligence is part of commercial domain of Tesco.  We help our customers and the communities where we operate get the most value from data. We look after Product data and associated entities and try to continuously enrich it. We have an opportunity to make difference in our our customers shop at Tesco . Product data plays crucial role across entire retail domain and enhancing it, creating new offering on top of it unlocks lot of Business values.",senior specialist (Senior),hybrid work,,,Kraków,False
"IoT Embedded Software Engineer C, C++, Python, Nvidia, nRF",WizzDev Prosta Spółka Akcyjna,"C++,C","https://www.pracuj.pl/praca/iot-embedded-software-engineer-c-c%2b%2b-python-nvidia-nrf-poznan-reymonta-5,oferta,1003672387","You will be developing software for novel instruments used by our clients. Initially, you will join one of the existing projects and be able to own part of the solution. We will also give you enough time to onboard into projects and required technologies. Our clients use interesting Machine Learning algorithms to process information from various sensors so there will be a lot of challenges. You will develop: processing, visualizations and storage for all data. In general - WizzDev projects require working with various embedded systems projects in the area of robotics and Internet of Things software - from design to production.","specialist (Mid / Regular), senior specialist (Senior)",hybrid work,,,Poznań,False
Junior Cloud Infrastructure Engineer,Shiji Poland,"Linux,Docker,Bash,Python,AWS,GitLab","https://www.pracuj.pl/praca/junior-cloud-infrastructure-engineer-katowice-chorzowska-148,oferta,1003705188","You will be designing, implementing and maintaining an infrastructure that is hosting a microservices-based application on AWS. Mission-critical, stable, long-term global product.,The decision-making center for infrastructure-related topics is located directly inside our team. We choose the technologies, we design the architecture. We implement it. We maintain it.,From a Junior Cloud Infrastructure Engineer  we require basic technical knowledge, more than technical skills we value his can-do attitude and ability to learn being guided in the right direction.,Technologies used in our team: AWS, Terraform, Kubernetes, Ansible, Elasticsearch, Kafka, PostgreSQL, VictoriaMetrics, Hashicorp stack, Gitlab, Nexus",junior specialist (Junior),home office work,6000–11000,gross / mth.,Katowice,False
Data Engineer in Technology Consulting,EY (dawniej Ernst & Young),"SQL,Python,Azure","https://www.pracuj.pl/praca/data-engineer-in-technology-consulting-warszawa-rondo-onz-1,oferta,1003698243","The Technology Consulting team works with world’s best-known large domestic and global: financial institutions, broker-dealers, foreign banking organizations, asset management and insurance companies, who trusted us to assist them with large scale transformation program delivery challenges.,This is an opportunity to be a part of a growing Data and Analytics team alongside Business Analysts, Developers and Testers with plenty of autonomy and variety in this role. We work with large, distributed data, pipelines, database tuning for efficient analysis and table schemas creations using extract, transform, load methods to deliver trustworthy and timely data to business executives and analysts and other end users so they can improve business operations.  Were looking for a technical practitioner open to learn new things and take up new opportunities in a multinational work environment.,You will contribute in providing exceptional subject matter expertise and solving complex problems to make a difference for our Clients. Colleagues and Clients from a diverse array of backgrounds will look to you first for answers, so you’ll be a high-profile contact when it comes to resolving complex issues. As you expand your knowledge and experience. You’ll become a credible advisor, influencing Clients and engagement teams on resolutions that will impact entire industries. We are looking for Candidates who will strengthen our Technology Solutions Delivery Team in Poland. We welcome skilled data engineers willing to contribute to Data & Analytics team in designing, developing, and implementing data solutions.. We will appreciate when You are willing to take initiative and seek out opportunities to grow a global data engineering team as well as, in defining and enforcing data engineering best practices. If you’re serious about progressing and ready to solve our clients’ most complex issues, this role is for you.,We are looking for Candidates who will strengthen our Technology Solutions Team in Poland. We welcome experienced professionals willing to develop in Data & Analytics area. We’re interested in professionals with a genuine interest to contribute to the growth of the Data capability.","specialist (Mid / Regular), junior specialist (Junior)",hybrid work,,,Warszawa,False
Elektronik Systemów Embedded,ECTRA GROUP SPÓŁKA Z OGRANICZONĄ ODPOWIEDZIALNOŚCIĄ,,"https://www.pracuj.pl/praca/elektronik-systemow-embedded-debogorze-pow-pucki-rumska-18,oferta,1003716989",,"specjalista (Mid / Regular), starszy specjalista (Senior)",praca stacjonarna,7000–11500,brutto / mies.,Dębogórze (pow. pucki),False
Analityk/ Analityczka Modelowania Predykcyjnego (Predictive Modeling Analytist),Integer Group Services Sp. z o.o,,"https://www.pracuj.pl/praca/analityk-analityczka-modelowania-predykcyjnego-predictive-modeling-analytist-warszawa-czerniakowska-87a,oferta,1003679523",,specjalista (Mid / Regular),praca hybrydowa,,,Warszawa,False
Data Software Engineer,EPAM Systems (Poland) sp. z o.o.,"SQL,Microsoft Azure,AWS,Google Cloud Platform","https://www.pracuj.pl/praca/data-software-engineer-krakow-fabryczna-1a,oferta,1003682410","If you are an experienced Python Developer yearning to expand your skills in the data field, we present an extraordinary opportunity to scale up as a Data Software Engineer!,You’ll broaden your skills set, enhance your career potential, and work with top trending technologies in a fascinating domain. This is a chance to step up, embrace change, and future-proof your career.,YOU WILL GAIN:,•	 Immediate employment as a Data Software Engineer from Day 1, in accordance with your seniority level – not as a beginner but as a qualified professional,•	This is an exceptional chance to evolve your Python experience with Data knowledge during the first two months,•	 Potential to work on exciting BigData projects upon successfully attaining Databricks certification within just two months of employment (EPAM provided),•	Be part of one of Poland's most significant and accelerating IT companies","specialist (Mid / Regular), senior specialist (Senior)",home office work,,,Kraków,False
AI Engineer,Be in IT,"Microsoft Azure,Google Cloud Platform,AWS,Docker,Kubernetes,Python,Pandas,NumPy","https://www.pracuj.pl/praca/ai-engineer-warszawa,oferta,1003713931","Współpraca z zespołem ""Data"" międzynarodowej firmy consultingowej, realizującej projekty z zakresu ML, prognozowania, Explainable AI, MLOps raz Data Engineering, dla klientów z branż finansowych/fintech z całego globu.",specjalista (Mid / Regular),praca hybrydowa,"140,00–180,00",netto (+ VAT) / godz.,,False
Lead Engineer (PIM Informatica),GPC GLOBAL TECHNOLOGY CENTER,"Python,Java,Master Data Management,Informatica,JavaScript,Product360,Stibo Systems","https://www.pracuj.pl/praca/lead-engineer-pim-informatica-krakow-lubicz-23a,oferta,1003678591","We are growing rapidly and therefore expanding our IT team. This team will empower the Dutch IT team. The Krakow team will be build based on the outcome for your investigation in cooperation with the Dutch team.,As the tech lead, you will be responsible for the code inside Informatica Product360 which contains: Java, Javascript, Python and integration (API, JSON) are parts of the foundation. We have already a team that builds our MVP, you and your future team will go from MVP to the moon. We are looking for a self-starter with a few years of experience on the job, and some experience as a lead.,Ideally, the Dutch team and the Krakow team meet a few times a year, varying between our locations.",senior specialist (Senior),hybrid work,,,Kraków,False
Data Architect,Edge One Solutions Sp. z o.o.,"Microsoft Azure,Grafana,Prometheus,Java,Scala,Python,SQL,Apache Spark,Databricks,Azure Data Factory,Azure Synapse","https://www.pracuj.pl/praca/data-architect-lublin,oferta,1003707494","O kliencie,Nasz klient jest wiodącym globalnym ubezpieczycielem morskim i jednym z największych klubów P&I (Protection and Indemnity). Jego podejście do underwritingu, roszczeń i zapobiegania stratom opiera się na niezachwianym zaangażowaniu w przejrzystość, elastyczność, wiedzę i szybkie rozwiązywanie problemów. Zasięg usług obejmuje cały świat, z biurami obejmującymi wszystkie główne regiony żeglugi, w tym Azję (Chiny, Hongkong, Singapur i Japonię), Australię (Australię i Nową Zelandię), Europę (Wielką Brytanię, Irlandię i Grecję) oraz USA.",specjalista (Mid / Regular),praca hybrydowa,,,,False
Security Integration and Automation Engineer,Aon Sp. z o.o.,,"https://www.pracuj.pl/praca/security-integration-and-automation-engineer-krakow-powstancow-wielkopolskich-13,oferta,1003678071",,"specialist (Mid / Regular), senior specialist (Senior)",hybrid work,,,Kraków,True
Trader Rynków Hurtowych,Grupa XOOG,,"https://www.pracuj.pl/praca/trader-rynkow-hurtowych-warszawa-wrobla-24,oferta,1003723872",,specjalista (Mid / Regular),praca stacjonarna,,,Warszawa,False
Data Engineer (pharma),7N Sp. z o.o.,"Snowflake,Python,AWS,Microsoft Azure,GitLab","https://www.pracuj.pl/praca/data-engineer-pharma-warszawa,oferta,1003672546","We are seeking a Data Engineer / Python Developer to join the project that deliver the metrics supporting informed decision-making in clinical trials. This position will support the end-to-end process of gathering the data from different business areas, integrating and calculating the KPI, and delivering the final metrics to the data visualisation team.",specialist (Mid / Regular),home office work,21000–22680,net (+ VAT) / mth.,,False
Aviation Market Forecasting Specialist,MTU Aero Engines Polska Sp. z o.o.,,"https://www.pracuj.pl/praca/aviation-market-forecasting-specialist-tajecina-pow-rzeszowski-108,oferta,1003719191",,specialist (Mid / Regular),hybrid work,,,Tajęcina (pow. rzeszowski),False
Technical Writer,SQUARE ONE RESOURCES sp. z o.o.,,"https://www.pracuj.pl/praca/technical-writer-warszawa,oferta,1003709904","We are looking for an experienced Technical Documentation Specialist to join our team and support our US-based client. In this role, you will be responsible for writing and maintaining technical documentation in Doxygen for the software features being developed.,The initial contract will be for six months, with the possibility of extension.","specialist (Mid / Regular), junior specialist (Junior)",home office work,13500–16000,net (+ VAT) / mth.,,False
Projektant Elektronik - Technolog Testu,PIT-RADWAR S.A.,,"https://www.pracuj.pl/praca/projektant-elektronik-technolog-testu-warszawa-poligonowa-30,oferta,1003696308",,"specjalista (Mid / Regular), starszy specjalista (Senior)",praca stacjonarna,,,Warszawa,False
GenAI & Data Engineer,Ivy Technology Poland Sp. z.o.o.,"AWS,Azure,Oracle,Neo4j,OpenAI,Kafka","https://www.pracuj.pl/praca/genai-data-engineer-bydgoszcz-fordonska-248g,oferta,1003673800",,"specialist (Mid / Regular), senior specialist (Senior)",hybrid work,,,Bydgoszcz,False
Senior Data Scientist - Computer Vision,Tesco Technology,"Python,Java","https://www.pracuj.pl/praca/senior-data-scientist-computer-vision-krakow-przy-rondzie-4,oferta,1003698200","At Tesco, our Data Science team focuses on modelling complex business problems and deploying data products at scale. Our work spans across multiple areas including physical stores, online, supply chain, marketing and Clubcard, where we encourage rotation amongst our Data Scientists so they can gain expertise in different subjects. We work on several domains and problem types: online, pricing, security, fulfilment, distribution, property, IoT and computer vision are just some. Our team members spend 10% of their week on learning and personal development. Multiple academic collaborations enrich the team expertise; knowledge sharing events are regular. Furthermore, we have got a great work-life balance, team days and relaxed but engaging culture.",senior specialist (Senior),hybrid work,24000–32000,gross / mth.,Kraków,False
Specjalista ds. utrzymania baz danych (SQL),Asseco Business Solutions S.A.,"SQL,MS SQL Server","https://www.pracuj.pl/praca/specjalista-ds-utrzymania-baz-danych-sql-lublin-konrada-wallenroda-4c,oferta,1003673842",,specjalista (Mid / Regular),"praca stacjonarna, praca hybrydowa",,,Lublin,False
Business Expert Data Science,Commerzbank AG,"Google Cloud Platform,Microsoft Azure,Python,Docker,Kubernetes,Bitbucket,Java","https://www.pracuj.pl/praca/business-expert-data-science-lodz-wersalska-6,oferta,1003670874","In agile teams we develop products end-to-end in a cloud environment. We use big data technology and advanced analytics to approach our clients, to increase the efficiency of our processes and to steer the bank’s risks or to protect the bank against fraud. Therefore, collaboration and communication with other areas of the bank is particular important.",expert,hybrid work,,,Łódź,False
Junior Test Automation Engineer,EY (dawniej Ernst & Young),"Java,JavaScript,Python","https://www.pracuj.pl/praca/junior-test-automation-engineer-warszawa-rondo-onz-1,oferta,1003698239","We are looking for Candidates to strengthen our Testing Team in Poland. We welcome experienced professionals as well as graduates willing to develop in Test Automation roles. We’re interested in professionals with a genuine interest to contribute to the growth of the Global Testing Community in technical and technology-focused testing roles. You can expect plenty of autonomy and variety in this role, so you’ll also need the ability to be nimble, take initiative and seek out opportunities to improve our current relationships, and prioritize participation in practice initiatives that will generate a long-term pipeline of projects for the firm. If you’re serious about progressing and ready to take on some of our clients’ most complex issues, this role is for you.",junior specialist (Junior),hybrid work,,,Warszawa,False
Business / Data Analyst,ARI10 sp. z o.o.,,"https://www.pracuj.pl/praca/business-data-analyst-poznan-jana-henryka-dabrowskiego-77,oferta,1003715802",,"specialist (Mid / Regular), senior specialist (Senior)",home office work,15000–23500,net (+ VAT) / mth.,Poznań,False
Administrator Systemów Linux oraz Sieci,Insert S.A.,Linux,"https://www.pracuj.pl/praca/administrator-systemow-linux-oraz-sieci-wroclaw-jerzmanowska-2,oferta,1003681425","Do wewnętrznego działu infrastruktury poszukujemy pasjonata Linuksa, rozwiązań Open Source oraz technologii sieciowych, który lubi zgłębiać tajniki i „dłubać pod maską” w systemach operacyjnych, oprogramowaniu/usługach serwerowych oraz sieciach komputerowych.,Nie boimy się nowych technologii informatycznych, szczególnie tych zwiększających bezpieczeństwo i rozwijających infrastrukturę. Jeśli podoba Ci się taka wizja – dołącz do nas jako,ADMINISTRATOR SYSTEMÓW LINUX oraz SIECI","specjalista (Mid / Regular), starszy specjalista (Senior)",praca stacjonarna,,,Wrocław,False
