title,company,expected,link,project,level,work mode,salary,salary_for,city,ukrainian_people
Technical Team Leader,1dea Kośnik Sp. k.,"Python,Django,React Native,Leadership,Team Management,Software Architecture","https://www.pracuj.pl/praca/technical-team-leader-warszawa,oferta,1003681212","Szukamy doświadczonego Kierownika Zespołu Technicznego, który dołączy do zespołu jednego z naszych Klientów.,Jako Kierownik Zespołu Technicznego będziesz nadzorował zespół programistów, w skład którego wchodzą programiści frontend i backend, inżynierowie QA oraz DevOps, zlokalizowany głównie w Polsce. Ta rola jest kluczowa dla kształtowania architektury systemu i zapewnienia, że wizja jest technicznie solidna i dobrze zaimplementowana. Będziesz ściśle współpracował z Analitykiem Biznesowym, Kierownikiem Projektu Technicznego i zespołami deweloperskimi, aby projektować i implementować systemy napędzające innowacyjność produktu naszego Klienta.,Delegacje: 1-3x w kwartale 2-3-dniowe delegacje do oddziału firmy w Londynie (do ustalenia, czy i jak często)",kierownik / koordynator,praca hybrydowa,"180,00–200,00",netto (+ VAT) / godz.,,False
Senior QA Engineer - Tribe Aplikacji Operacyjnych,ING Bank Śląski S.A.,"Azure DevOps,Git,Selenium,Python","https://www.pracuj.pl/praca/senior-qa-engineer-tribe-aplikacji-operacyjnych-warszawa,oferta,1003705514","W Tribe Aplikacji Operacyjnych zajmujemy się Silnikiem Banku. To tu znajdziesz kluczowe aplikacje, które zapewniają działanie ING Banku Śląskiego.,Aplikacja do której poszukujemy Inżyniera testów, ma charakter finansowy, służy do obsługi procesu wykupu wierzytelności. Naszym celem jest zbudowanie systemu przyjaznego dla użytkownika i zautomatyzowanie wielu żmudnych czynności by odciążyć pracowników operacyjnych, rozwijać aplikację w obszarach międzynarodowych.,Częścią wspólną dla wszystkich projektów jest praca w metodyce zwinnej Scrum. Pracujemy w modelu hybrydowym i zależy nam na tym byśmy spotykali się w biurze.",starszy specjalista (Senior),praca hybrydowa,8400–22000,brutto / mies.,,False
Data Engineer Trainee (f/m),Axpo Polska sp. z o.o.,"SQL,Python,GitLab,Google Cloud Platform,Snowflake,DBT","https://www.pracuj.pl/praca/data-engineer-trainee-f-m-warszawa-rondo-daszynskiego-2b,oferta,1003683038",,praktykant / stażysta,praca hybrydowa,,,Warszawa,False
Ekspertka / Ekspert ds. Taryfikacji Ubezpieczeń,Compensa Towarzystwo Ubezpieczeń S.A. Vienna Insurance Group,,"https://www.pracuj.pl/praca/ekspertka-ekspert-ds-taryfikacji-ubezpieczen-warszawa,oferta,1003674952",,ekspert,praca hybrydowa,,,,False
Senior Test Engineer,Strive Sp. z o.o.,"Java,Selenium,Python,GitLab,Git","https://www.pracuj.pl/praca/senior-test-engineer-gdansk-aleja-grunwaldzka-472d,oferta,1003684281","Dla jednego z naszych Klientów, międzynarodowej firmy tworzącej aplikacje mobilne i webowe, poszukujemy osób na stanowisko: Senior Test Engineer",starszy specjalista (Senior),praca hybrydowa,10000–18000,brutto / mies.,Gdańsk,False
Senior Optimization and Big Data Specialist,Scalo Sp. z o.o.,"Python,Git,GitLab","https://www.pracuj.pl/praca/senior-optimization-and-big-data-specialist-warszawa,oferta,1003679323","Obszary naszego działania to m.in.: doradztwo technologiczne, tworzenie oprogramowania, systemy wbudowane, rozwiązania chmurowe, zarządzanie danymi, dedykowane zespoły developerskie.",starszy specjalista (Senior),"praca zdalna, praca hybrydowa","150,00–180,00",netto (+ VAT) / godz.,,False
ISC Analytics and Reporting Manager,Rockwell Automation,"Microsoft Azure,SQL,PowerApps,Power Automate,Databricks,Python,R","https://www.pracuj.pl/praca/isc-analytics-and-reporting-manager-katowice-francuska-46,oferta,1003693913","As an ISC Reporting Team manager, you will lead a global team and will report to the ISC Reporting team Sr Manager. You will collaborate with IT and functional partners to develop power platform solutions, data science solutions, workload planning for the team and provide guidance for employees on development needs. We are looking for someone that has experience with data and can provide solutions that create value for our partners. You will provide experience through information design and advanced data analytics.","manager / supervisor, team manager",hybrid work,,,Katowice,False
Cloud Engineer - Tech Lead,Cyclad,"AWS,Azure DevOps,Terraform,TypeScript,JavaScript,Node.js,Python,PySpark,SQL","https://www.pracuj.pl/praca/cloud-engineer-tech-lead-katowice,oferta,1003668835","Currently, we are seeking a Cloud Engineer to join the international team of a leading company in technology consulting and digital transformation.,Project information:,•	Location: Katowice (hybrid model of work - once a week from the office),•	Type of employment: B2B contract,•	Remuneration: 150 - 160 PLN net + VAT per hour on B2B,•	Project language: English","senior specialist (Senior), expert",hybrid work,"150,00–160,00",net (+ VAT) / hr.,,True
DevOps Specialist / Platform Engineer,Schenker Technology Center Warsaw Sp. z o.o.,"Kubernetes,Docker,GitLab,Sonar,Nexus,Grafana,SQL","https://www.pracuj.pl/praca/devops-specialist-platform-engineer-warszawa-zwirki-i-wigury-16c,oferta,1003707814","At Schenker, DevOps Specialists are responsible for fast feature flow from code to production. They work closely with all parties involved in the software development process. This includes participation in software architecture, automation of build, testing, and deployment processes, build and maintenance of software development environments, as well as design, implementation, and operations of software operation platforms.,This position is part of the TSC Application Platform Service team. The application platform includes both Kubernetes clusters as runtime environment for containerized applications and a toolbox for software development and operations that covers build, monitoring, and security tools. All of that is in the cloud, with AWS as main provider at the moment.","specialist (Mid / Regular), senior specialist (Senior)",hybrid work,,,Warszawa,True
Senior Test Automation Engineer,Devire,,"https://www.pracuj.pl/praca/senior-test-automation-engineer-warszawa,oferta,1003697209","Devire IT Outsourcing is a form of cooperation dedicated to IT professionals, based on the principles of own business - B2B, implementing projects for clients running innovative and modern projects.,For our client, one of the the largest bank having a strong market position in the Northern Europe region, we are looking for a specialist for the position of Senior Test Automation Engineer.,In this role, you’ll help expand the Data Lake and build Data Marts to support data democratization, using technologies like Hadoop, Snowflake, Python, and SQL. You’ll also work with tools like Robot Framework, Git, and AWS to create efficient, scalable data workflows, enabling data accessibility across the organization.",senior specialist (Senior),hybrid work,130–150,net (+ VAT) / mth.,,False
Test Automation Engineer,Google,"Python,Shell,Go","https://www.pracuj.pl/praca/test-automation-engineer-warszawa-emilii-plater-53,oferta,1003694999","At Google, our philosophy is build it, break it and then rebuild it better. That thinking is at the core of how we approach testing at Google. Unlike roles with similar names at the other companies, Test Engineers at Google aren't manual testers -- you write scripts to automate testing and create tools so developers can test their own code. As a Test Engineer, you navigate Google's massive codebase, identify weak spots and constantly design better and creative ways to break software and identify potential problems. You'll have a huge impact on the quality of Google's growing suite of products and services.,You use your knowledge of testing and testability to influence better software design, promote proper engineering practice, bug prevention strategies, testability, accessibility, privacy, and other advanced quality concepts across products.,The Google Pixel team focuses on designing and delivering the world's most helpful mobile experience. The team works on shaping the future of Pixel devices and services through some of the most advanced designs, techniques, products, and experiences in consumer electronics. This includes bringing together the best of Google’s artificial intelligence, software, and hardware to build global smartphones and create transformative experiences for users across the world.",specialist (Mid / Regular),hybrid work,,,Warszawa,False
Technical Product Manager,BYTAMIC SOLUTIONS SPÓŁKA Z OGRANICZONĄ ODPOWIEDZIALNOŚCIĄ,"Data Center,Cloud,Agile","https://www.pracuj.pl/praca/technical-product-manager-warszawa,oferta,1003719651","For our Client – a global IT infrastructure monitoring company, we are looking for a Technical Product Manager with a good knowledge of English. Employment directly by the Client.",senior specialist (Senior),home office work,26000–28000,gross / mth.,,False
Engineering Platform IT System Specialist,Hitachi Energy Poland Sp. z o.o.,".Net,C++,Python","https://www.pracuj.pl/praca/engineering-platform-it-system-specialist-lodz-aleksandrowska-67,oferta,1003703650",We are looking for an Engineering Platform IT System Analyst to join an international development team that takes care of Engineering Design Platform development. We are looking for experienced candidate who will support us with breaking down business processes and then assist in finding ways to optimize them with the focus on design platform for transformer designers. The candidate should pose strong willingness to build strong relationship between business and engineering.,specialist (Mid / Regular),full office work,,,Łódź,False
DevOps Engineer,Tenesys Sp. z o.o.,"AWS,Microsoft Azure,Docker,Kubernetes,CI/CD,IaC,DataBases,Linux.","https://www.pracuj.pl/praca/devops-engineer-poznan-wroniecka-18,oferta,1003670179","Specjalizujemy się w migracjach, szeroko pojętym DevOpsie, automatyzacji procesów wytwarzania oprogramowania oraz cybersecurity. Jako partnerzy technologiczni AWS, Microsoft Azure, GCP i OVHcloud działamy globalnie, pomagając firmom w rozwoju technologicznym.,Przykładowe projekty: https://tenesys.io/case-studies/,Tech stack: (tak szeroki wachlarz technologiczny możesz spotkać w firmie),Chmury publiczne:,AWS (EKS, ECS, VPC, EC2, Lambda, RDS, Cloudfront, Route 53, S3, CloudFormation, IAM),Azure (AKS, Azure Container App, SQL Database, Azure Front Door, Blob storage, ARM, Entra),GCP (GKE, Cloud Run, Cloud Compute, Cloud SQL, Cloud CDN, Cloud Storage, IAM),Chmury prywatne: Proxmox, VMWare, HyperV,Systemy operacyjne: Windows / Linux wraz z usługami spokrewnionymi (np. Active Directory, Kerberos, NFS, IIS, LDAP, NFS, serwery WWW etc.),Narzędzia: Docker, Kubernetes, Helm, ArgoCD, Ansible, bazy danych relacyjne i nierelacyjne (Elasticsearch/OpenSearch, mongoDB, PostgreSQL, MySQL, MSSQL), CI/CD GitLab, Github, Jenkins, IaC - Terraform, Python, Bash, PowerShell,Certyfikacja: Minimum poziom associate (gotowość do zdania, po rozpoczęciu pracy)",specjalista (Mid / Regular),praca hybrydowa,15000–21000,netto (+ VAT) / mies.,Poznań,False
Python Developer (Mid and Seniors),emagine dla Konsultantów IT,"Python,React.js,AWS EC2,Terraform,CloudFormation,Kubernetes","https://www.pracuj.pl/praca/python-developer-mid-and-seniors-warszawa,oferta,1003670930","📌 Industry: Fintech,📌 Work model: 3 days onsite / Warsaw centrum,📌 Contract’s length: B2B, 3 months + extension,📌 Project language: English,📌 Start: 1 month / 2 months,We are currently looking for skilled Python Developer to join a leading global fintech company that provides smarter and more flexible payment experiences.,You will join to different domains such as: Card and Banking, Decisioning Banking servicing, Engineering Platform, Partner Operations and Product, Payment Method and Shopping Experience.","specialist (Mid / Regular), senior specialist (Senior)",hybrid work,"130,00–170,00",net (+ VAT) / hr.,,False
Sales Analytics Team Leader,Wakacje.pl,,"https://www.pracuj.pl/praca/sales-analytics-team-leader-gdansk-aleja-grunwaldzka-413,oferta,1003700063",,menedżer,praca hybrydowa,,,Gdańsk,False
Expert R&D AI,NetWorks Sp. z o.o.,"Python,R,Java,TensorFlow,Ollama,LlamaIndex,Microsoft Azure,Google Cloud Platform","https://www.pracuj.pl/praca/expert-r-d-ai-warszawa,oferta,1003703987",,ekspert,"praca zdalna, praca hybrydowa",,,,False
Test Automation Engineer,EY (dawniej Ernst & Young),"Java,Python,JavaScript,Selenium,Selenide,Jira,Azure DevOps","https://www.pracuj.pl/praca/test-automation-engineer-warszawa-rondo-onz-1,oferta,1003698238","We are looking for candidates to strengthen our Testing Team in Poland. We welcome experienced professionals as well as graduates willing to develop in Test Automation roles. We’re interested in professionals with a genuine interest to contribute to the growth of the Global Testing Community in technical and technology-focused testing roles. You can expect plenty of autonomy and variety in this role, so you’ll also need the ability to be nimble, take initiative and seek out opportunities to improve our current relationships, and prioritize participation in practice initiatives that will generate a long-term pipeline of projects for the firm. If you’re serious about progressing and ready to take on some of our clients’ most complex issues, this role is for you.",specialist (Mid / Regular),hybrid work,,,Warszawa,False
Data Science Trainee (f/m),Axpo Polska sp. z o.o.,"Python,SQL","https://www.pracuj.pl/praca/data-science-trainee-f-m-warszawa-rondo-daszynskiego-2b,oferta,1003682788",,trainee,hybrid work,,,Warszawa,False
Specjalista DevOps,ALLIANCE TECHNOLOGY POLSKA,"Redhat/Ubuntu Linux,Oracle DB,PostgreSQL,Jenkins,Git,Sonar,Docker","https://www.pracuj.pl/praca/specjalista-devops-poznan-dabrowskiego-29,oferta,1003673556","Poszukujemy specjalisty do naszego zgranego zespołu na poznańskich Jeżycach, który wspierałby zespoły developerskie w zakresie rozwoju i utrzymania środowisk CI/CD, platform testowych i produkcyjnych opartych na technologiach konteneryzacji dla systemów rozwijanych w technologiach Java+SpringBoot, C#/ASP.NET, Oracle DB, Postgres.","specjalista (Mid / Regular), młodszy specjalista (Junior)",praca stacjonarna,,,Poznań,False
Senior Business Analyst,Allegro,,"https://www.pracuj.pl/praca/senior-business-analyst-poznan-wierzbiecice-1b,oferta,1003692012",,starszy specjalista (Senior),praca hybrydowa,,,Poznań,False
Assistant Vice President Financial Engineering – Senior Developer (AI/ML area – frontend/full stack),HSBC Service Delivery (Polska) Sp. z o.o.,"Python,Django,Flask,FastAPI,Next.js,React,Angular,TypeScript","https://www.pracuj.pl/praca/assistant-vice-president-financial-engineering-senior-developer-ai-ml-area-front-krakow-kapelanka-42a,oferta,1003694292","Global Finance aspires to be the best finance function in the financial services industry, delivering powerful insights to our customers, within the bank and externally. We work as a seamless team to support HSBC’s businesses to deliver our strategy. This role is focused on building new, future-proof modelling solutions.",manager / supervisor,hybrid work,,,Kraków,True
"Application Developer (Node.js, AWS)",ITFS sp. z o.o.,"AWS,Node.js,AWS Lambda,AWS S3,SQS,Kinesis","https://www.pracuj.pl/praca/application-developer-node-js-aws-warszawa,oferta,1003689109","Miejsce pracy: 100% zdalnie/hybrydowo/stacjonarnie (Warszawa),Start pracy: ASAP (akceptowalny max 1 msc okresu wypowiedzenia),Forma współpracy: B2B,Stawka: 125-150 zł/h netto + VAT",specjalista (Mid / Regular),"praca stacjonarna, praca zdalna, praca hybrydowa","125,00–150,00",netto (+ VAT) / godz.,,False
Starszy Specjalista ds. Baz Danych i Modelowania Ryzyka,PKO Bank Polski SA,"SQL,R,Python","https://www.pracuj.pl/praca/starszy-specjalista-ds-baz-danych-i-modelowania-ryzyka-warszawa-swietokrzyska-36,oferta,1003711945","Dołącz do nas jako:  STARSZY SPECJALISTA DS. BAZ DANYCH I MODELOWANIA RYZYKA - Departament Analiz Kredytów Hipotecznych i Oceny Zabezpieczeń,Stack technologiczny:,Obszar: Tworzenie i utrzymanie baz danych oraz modeli oceny ryzyka,Zarządzanie: Analiza i raportowanie danych związanych z zabezpieczeniami, dokumentacja modeli ryzyka,Narzędzia: VBA, SQL, R, Python, SAS (mile widziane),Umiejętności: Techniki modelowania (ekonometryczne, modele szeregów czasowych, metody symulacyjne, metody ML), analiza danych, budowa baz danych,Doświadczenie: Wykształcenie wyższe w obszarze informatyki, matematyki, ekonomii lub metod ilościowych; praktyczne doświadczenie w programowaniu i analizie danych,Pracuj w miejscu, które zna każdy.,#TyWybierasz",starszy specjalista (Senior),praca hybrydowa,,,Warszawa,False
Senior DevOps,4IT SOLUTIONS sp. z o.o.,"Microsoft Azure,Kubernetes,Helm,Linux,Git,GitOps,Terraform,Java","https://www.pracuj.pl/praca/senior-devops-lodz,oferta,1003669751","Projekt dotyczy prac nad rozwijaniem środowisk technologicznych, których architektura pełni kluczową rolę w branży telekomunikacyjnej. Środowiska mają zasięg globalny i dotyczą API produktów, sieci i platform komunikacyjnych nowej generacji.","starszy specjalista (Senior), ekspert",praca hybrydowa,,,,False
Product Support Analyst,Brown Brothers Harriman,,"https://www.pracuj.pl/praca/product-support-analyst-krakow-stanislawa-klimeckiego-1,oferta,1003693612",,specialist (Mid / Regular),hybrid work,,,Kraków,True
"Software Engineering Manager, Cloud Run Serverless UI",Google,"Python,C,C++,Java,JavaScript","https://www.pracuj.pl/praca/software-engineering-manager-cloud-run-serverless-ui-warszawa-emilii-plater-53,oferta,1003694971","Like Google's own ambitions, the work of a Software Engineer goes beyond just Search. Software Engineering Managers have not only the technical expertise to take on and provide technical leadership to major projects, but also manage a team of Engineers. You not only optimize your own code but make sure Engineers are able to optimize theirs. As a Software Engineering Manager you manage your project goals, contribute to product strategy and help develop your team. Teams work all across the company, in areas such as information retrieval, artificial intelligence, natural language processing, distributed computing, large-scale system design, networking, security, data compression, user interface design; the list goes on and is growing every day. Operating with scale and speed, our exceptional software engineers are just getting started -- and as a manager, you guide the way.,With technical and leadership expertise, you manage engineers across multiple teams and locations, a large product budget and oversee the deployment of large-scale projects across multiple sites internationally.,Cloud Run is one of the google cloud projects. Cloud Run allows to develop and deploy highly scalable applications on a fully managed serverless platform. Cloud Run UI plays a critical role in those products, providing an enhanced developer experience, abstracting away the infrastructure management, and cross-product integrations. We're a full stack engineering team owning UI product development for Cloud Run. We focus on user experience and product excellence. Closely cooperating with our partners UX designers, Product Managers and adjacent back-end teams. We form a center of excellence of UI engineering, developed in both Angular and Java.,Google Cloud accelerates every organization’s ability to digitally transform its business and industry. We deliver enterprise-grade solutions that leverage Google’s cutting-edge technology, and tools that help developers build more sustainably. Customers in more than 200 countries and territories turn to Google Cloud as their trusted partner to enable growth and solve their most critical business problems.",senior specialist (Senior),hybrid work,,,Warszawa,False
Senior .NET Engineer,Macrix Technology Group,.NET,"https://www.pracuj.pl/praca/senior-net-engineer-poznan-marcelinska-90,oferta,1003674089","We are looking for Senior .NET Engineers who not only excel in .NET but are also eager to expand their expertise by learning a range of critical technologies that drive mission-critical systems across industries. While your core skill set will be focused on .NET, we see our competitive advantage in offering opportunities to dive into foundational technologies like C++, Python, or Java 🔍. These languages play a crucial role in industries such as finance, embedded systems, and aerospace, where precision, control, and performance are essential ✈️.,We’re seeking individuals who are ready to embrace these challenges and step into core technology projects whenever needed, with the full support of our mentors, CodeGenQ, and continuous mentorship from senior team members 💡. You won’t need to have mastered these technologies yet, but if you're willing to learn and grow, we will provide the tools and guidance to help you succeed.",senior specialist (Senior),hybrid work,12000–20000,gross / mth.,Poznań,False
Engineering Platform IT System Specialist,Hitachi Energy Poland Sp. z o.o.,".Net,C++,Python","https://www.pracuj.pl/praca/engineering-platform-it-system-specialist-krakow-pawia-7,oferta,1003703654",We are looking for an Engineering Platform IT System Analyst to join an international development team that takes care of Engineering Design Platform development. We are looking for experienced candidate who will support us with breaking down business processes and then assist in finding ways to optimize them with the focus on design platform for transformer designers. The candidate should pose strong willingness to build strong relationship between business and engineering.,specialist (Mid / Regular),full office work,,,Kraków,False
Java Developer,Connectis_,"Java,Spring Framework,Git,Maven,Redis","https://www.pracuj.pl/praca/java-developer-szczecin,oferta,1003725313","Dołącz do zespołu tworzącego innowacyjne gry mobilne! Jeśli pasjonujesz się programowaniem, masz doświadczenie w branży gier i chcesz współtworzyć wyjątkowe produkty gamingowe – ta oferta jest właśnie dla Ciebie! 🎮✨,Wspólnie z naszym Partnerem poszukujemy osoby na stanowisko Java Developer, który dołączy do dynamicznego zespołu pracującego przy tworzeniu nowoczesnych gier mobilnych.,📌 model hybrydowy - Szczecin / 100% zdalnie",starszy specjalista (Senior),praca hybrydowa,"113,00–166,00",netto (+ VAT) / godz.,,False
Senior Python Developer (with GenAI),EPAM Systems (Poland) sp. z o.o.,"Python,AWS,Google Cloud Platform,Microsoft Azure","https://www.pracuj.pl/praca/senior-python-developer-with-genai-krakow-fabryczna-1a,oferta,1003682402","We are seeking a Senior Python Developer (with GenAI) to join the project, which involves adoption of Artificial Intelligence solutions by our clients and focusing on generative AI.,In this role, you will be responsible for delivering multiple Proof of Concepts (POCs) and solving challenges using generative AI. Our approach is fluid and dynamic. This is a role that offers the freedom to innovate and evolve.,It is a fully remote position offering you the flexibility to work from any location in Poland, whether it's your home or one of our well-equipped offices in Gdansk, Katowice, Krakow, Lodz, Warsaw, or Wroclaw.",senior specialist (Senior),home office work,,,Kraków,False
Marketing Analytics Team Leader,Wakacje.pl,,"https://www.pracuj.pl/praca/marketing-analytics-team-leader-gdansk-aleja-grunwaldzka-413,oferta,1003699942",,menedżer,praca hybrydowa,,,Gdańsk,False
Data Scientist,T-Mobile,"Python,SQL,Git,Jira,Confluence,AWS,DataRobot","https://www.pracuj.pl/praca/data-scientist-warszawa-marynarska-12,oferta,1003670662","T-Mobile Poland is a workplace full of mutual inspiration and extraordinary challenges. We act boldly, we are responsible for the decisions we make, we cooperate and experiment!,If you want to be up-to-date with the news from the world of technology and telecommunications and support our team with your competence and experience, share your knowledge and count on the same from our side - don't wait and join #MagentaTeam!",specialist (Mid / Regular),full office work,,,Warszawa,True
Młodsza Specjalistka / Młodszy Specjalista ds. Taryfikacji Ubezpieczeń,Compensa Towarzystwo Ubezpieczeń S.A. Vienna Insurance Group,,"https://www.pracuj.pl/praca/mlodsza-specjalistka-mlodszy-specjalista-ds-taryfikacji-ubezpieczen-warszawa,oferta,1003689493",,młodszy specjalista (Junior),praca hybrydowa,,,,False
Data Engineer,Silky Coders sp. z o.o.,"Microsoft SQL Server,SQL,Python,NumPy,Pandas","https://www.pracuj.pl/praca/data-engineer-gdansk-dlugie-ogrody-12,oferta,1003682925","Poszukujemy Data Engineera, który dołączy do naszego zespołu i będzie odpowiedzialny za projektowanie, budowanie oraz utrzymanie rozwiązań do przetwarzania danych. W tej roli będziesz integrować modele uczenia maszynowego z istniejącymi aplikacjami, przygotowywać dane na potrzeby trenowania modeli ML oraz optymalizować procesy przetwarzania danych. Kluczowym elementem Twojej pracy będzie współpraca z zespołem analityków oraz Data Scientistów, aby zapewnić efektywne działanie aplikacji oraz płynne wdrażanie nowych rozwiązań opartych na danych. Dodatkowo, będziesz odpowiedzialny za modyfikację i optymalizację istniejących procesów przetwarzania danych w funkcjonujących aplikacjach, aby dostosować je do rosnących wymagań biznesowych i technologicznych.",specjalista (Mid / Regular),praca hybrydowa,,,Gdańsk,False
